[
  { "id":"greenhouse:anthropic", "company":{"name":"Anthropic","domain":"anthropic.com"}, "careersUrl":"https://www.anthropic.com/careers", "adapter":"greenhouse", "boardId":"anthropic", "endpointUrl":"https://boards-api.greenhouse.io/v1/boards/anthropic/jobs?content=true", "headquartersCountryCode":"US", "hiringCountryCodes":["AU","CA","CH","DE","FR","GB","IE","IN","JP","KR","SG","US"], "hiringRegionCodes":["AMERICAS","APAC","EMEA"], "knownCityLocations":[], "opportunityHistory":{"categories":[],"observedCount":0}, "remoteHistory":{"scopes":[],"observedCount":0}, "languages":["en"], "status":"verified", "lastVerified":"2026-07-15", "verification":{"method":"complete_public_ats_scan","result":"success","observedJobs":415}, "proposedBy":"maintainer", "autoEnqueue":true, "notes":"Hiring geography reflects current listing locations, not headquarters." },
  { "id":"greenhouse:intercom", "company":{"name":"Intercom","domain":"intercom.com"}, "careersUrl":"https://www.intercom.com/careers", "adapter":"greenhouse", "boardId":"intercom", "endpointUrl":"https://boards-api.greenhouse.io/v1/boards/intercom/jobs?content=true", "headquartersCountryCode":"US", "hiringCountryCodes":["AU","DE","GB","IE","US"], "hiringRegionCodes":["AMERICAS","APAC","EMEA"], "knownCityLocations":[], "opportunityHistory":{"categories":[],"observedCount":0}, "remoteHistory":{"scopes":[],"observedCount":0}, "languages":["en"], "status":"verified", "lastVerified":"2026-07-15", "verification":{"method":"complete_public_ats_scan","result":"success","observedJobs":139}, "proposedBy":"maintainer", "autoEnqueue":true, "notes":"Current public Greenhouse board completed successfully." },
  { "id":"greenhouse:airtable", "company":{"name":"Airtable","domain":"airtable.com"}, "careersUrl":"https://www.airtable.com/careers", "adapter":"greenhouse", "boardId":"airtable", "endpointUrl":"https://boards-api.greenhouse.io/v1/boards/airtable/jobs?content=true", "headquartersCountryCode":"US", "hiringCountryCodes":["AU","CA","FR","GB","US"], "hiringRegionCodes":["AMERICAS","APAC","EMEA"], "knownCityLocations":[], "opportunityHistory":{"categories":[],"observedCount":0}, "remoteHistory":{"scopes":["countries"],"observedCount":24}, "languages":["en"], "status":"verified", "lastVerified":"2026-07-15", "verification":{"method":"complete_public_ats_scan","result":"success","observedJobs":39}, "proposedBy":"maintainer", "autoEnqueue":true, "notes":"Remote history is evidence from current country-scoped listings." },
  { "id":"greenhouse:vercel", "company":{"name":"Vercel","domain":"vercel.com"}, "careersUrl":"https://vercel.com/careers", "adapter":"greenhouse", "boardId":"vercel", "endpointUrl":"https://boards-api.greenhouse.io/v1/boards/vercel/jobs?content=true", "headquartersCountryCode":"US", "hiringCountryCodes":["AU","DE","GB","US"], "hiringRegionCodes":["AMERICAS","APAC","EMEA"], "knownCityLocations":[], "opportunityHistory":{"categories":[],"observedCount":0}, "remoteHistory":{"scopes":["countries"],"observedCount":8}, "languages":["en"], "status":"verified", "lastVerified":"2026-07-15", "verification":{"method":"complete_public_ats_scan","result":"success","observedJobs":69}, "proposedBy":"maintainer", "autoEnqueue":true, "notes":"Current listing evidence only." },
  { "id":"greenhouse:arizeai", "company":{"name":"Arize AI","domain":"arize.com"}, "careersUrl":"https://arize.com/careers", "adapter":"greenhouse", "boardId":"arizeai", "endpointUrl":"https://boards-api.greenhouse.io/v1/boards/arizeai/jobs?content=true", "headquartersCountryCode":"US", "hiringCountryCodes":["AU","GB","KR","MY","SG","US"], "hiringRegionCodes":["AMERICAS","APAC","EMEA"], "knownCityLocations":[], "opportunityHistory":{"categories":[],"observedCount":0}, "remoteHistory":{"scopes":["countries","region","location_restricted"],"observedCount":32}, "languages":["en"], "status":"verified", "lastVerified":"2026-07-15", "verification":{"method":"complete_public_ats_scan","result":"success","observedJobs":36}, "proposedBy":"maintainer", "autoEnqueue":true, "notes":"EMEA/APAC tags come from current listing wording." },
  { "id":"greenhouse:gleanwork", "company":{"name":"Glean","domain":"glean.com"}, "careersUrl":"https://www.glean.com/careers", "adapter":"greenhouse", "boardId":"gleanwork", "endpointUrl":"https://boards-api.greenhouse.io/v1/boards/gleanwork/jobs?content=true", "headquartersCountryCode":"US", "hiringCountryCodes":["CA","DE","GB","IN","JP","US"], "hiringRegionCodes":["AMERICAS","APAC","EMEA"], "knownCityLocations":[], "opportunityHistory":{"categories":["internship"],"observedCount":1}, "remoteHistory":{"scopes":["countries"],"observedCount":27}, "languages":["en"], "status":"verified", "lastVerified":"2026-07-15", "verification":{"method":"complete_public_ats_scan","result":"success","observedJobs":128}, "proposedBy":"maintainer", "autoEnqueue":true, "notes":"Includes observed India and internship listings." },
  { "id":"greenhouse:contentful", "company":{"name":"Contentful","domain":"contentful.com"}, "careersUrl":"https://www.contentful.com/careers", "adapter":"greenhouse", "boardId":"contentful", "endpointUrl":"https://boards-api.greenhouse.io/v1/boards/contentful/jobs?content=true", "headquartersCountryCode":"DE", "hiringCountryCodes":["DE","GB","IE","US"], "hiringRegionCodes":["AMERICAS","EMEA"], "knownCityLocations":[], "opportunityHistory":{"categories":[],"observedCount":0}, "remoteHistory":{"scopes":[],"observedCount":0}, "languages":["en"], "status":"verified", "lastVerified":"2026-07-15", "verification":{"method":"complete_public_ats_scan","result":"success","observedJobs":33}, "proposedBy":"maintainer", "autoEnqueue":true, "notes":"Current listing evidence only." },
  { "id":"greenhouse:zscaler", "company":{"name":"Zscaler","domain":"zscaler.com"}, "careersUrl":"https://www.zscaler.com/careers", "adapter":"greenhouse", "boardId":"zscaler", "endpointUrl":"https://boards-api.greenhouse.io/v1/boards/zscaler/jobs?content=true", "headquartersCountryCode":"US", "hiringCountryCodes":["AT","AU","BE","CA","CH","CR","DE","DK","FI","FR","GB","HK","ID","IL","IN","IT","JP","KR","MY","NL","PH","PL","SE","SG","TW","US"], "hiringRegionCodes":["AMERICAS","APAC","EMEA"], "knownCityLocations":[], "opportunityHistory":{"categories":["internship"],"observedCount":6}, "remoteHistory":{"scopes":["countries"],"observedCount":0}, "languages":["en"], "status":"verified", "lastVerified":"2026-07-15", "verification":{"method":"complete_public_ats_scan","result":"success","observedJobs":337}, "proposedBy":"maintainer", "autoEnqueue":true, "notes":"Broad country set is derived from the current board, including country-restricted remote wording." },
  { "id":"greenhouse:twilio", "company":{"name":"Twilio","domain":"twilio.com"}, "careersUrl":"https://www.twilio.com/company/jobs", "adapter":"greenhouse", "boardId":"twilio", "endpointUrl":"https://boards-api.greenhouse.io/v1/boards/twilio/jobs?content=true", "headquartersCountryCode":"US", "hiringCountryCodes":["AU","BR","CA","CO","EE","ES","GB","IE","IN","JP","MX","SG","US"], "hiringRegionCodes":["AMERICAS","APAC","EMEA","LATAM"], "knownCityLocations":[], "opportunityHistory":{"categories":[],"observedCount":0}, "remoteHistory":{"scopes":["countries"],"observedCount":158}, "languages":["en"], "status":"verified", "lastVerified":"2026-07-15", "verification":{"method":"complete_public_ats_scan","result":"success","observedJobs":163}, "proposedBy":"maintainer", "autoEnqueue":true, "notes":"Remote does not mean worldwide; current listings are country-scoped." },
  { "id":"greenhouse:groww", "company":{"name":"Groww","domain":"groww.in"}, "careersUrl":"https://groww.in/careers", "adapter":"greenhouse", "boardId":"groww", "endpointUrl":"https://boards-api.greenhouse.io/v1/boards/groww/jobs?content=true", "headquartersCountryCode":"IN", "hiringCountryCodes":["IN"], "hiringRegionCodes":["APAC"], "knownCityLocations":["Bengaluru"], "opportunityHistory":{"categories":["internship"],"observedCount":5}, "remoteHistory":{"scopes":[],"observedCount":0}, "languages":["en"], "status":"verified", "lastVerified":"2026-07-15", "verification":{"method":"complete_public_ats_scan","result":"success","observedJobs":15}, "proposedBy":"maintainer", "autoEnqueue":true, "notes":"India is one verified regression market in the global registry." },
  { "id":"ashby:cohere", "company":{"name":"Cohere","domain":"cohere.com"}, "careersUrl":"https://cohere.com/careers", "adapter":"ashby", "boardId":"cohere", "endpointUrl":"https://api.ashbyhq.com/posting-api/job-board/cohere?includeCompensation=true", "headquartersCountryCode":"CA", "hiringCountryCodes":["CA","DE","FR","GB","JP","KR","SA","SG","US"], "hiringRegionCodes":["AMERICAS","APAC","EMEA","GCC"], "knownCityLocations":[], "opportunityHistory":{"categories":["internship","fellowship"],"observedCount":3}, "remoteHistory":{"scopes":["countries","region"],"observedCount":107}, "languages":["en"], "status":"verified", "lastVerified":"2026-07-15", "verification":{"method":"complete_public_ats_scan","result":"success","observedJobs":134}, "proposedBy":"maintainer", "autoEnqueue":true, "notes":"Current listing evidence spans multiple regions; no global-hiring claim." },
  { "id":"ashby:ramp", "company":{"name":"Ramp","domain":"ramp.com"}, "careersUrl":"https://ramp.com/careers", "adapter":"ashby", "boardId":"ramp", "endpointUrl":"https://api.ashbyhq.com/posting-api/job-board/ramp?includeCompensation=true", "headquartersCountryCode":"US", "hiringCountryCodes":["AR","CA","GB","US"], "hiringRegionCodes":["AMERICAS","EMEA","LATAM"], "knownCityLocations":[], "opportunityHistory":{"categories":["internship"],"observedCount":1}, "remoteHistory":{"scopes":["countries"],"observedCount":21}, "languages":["en"], "status":"verified", "lastVerified":"2026-07-15", "verification":{"method":"complete_public_ats_scan","result":"success","observedJobs":125}, "proposedBy":"maintainer", "autoEnqueue":true, "notes":"Current listing evidence only." },